mep_name,jurisdiction,political_group,email,staff_contact_name,staff_contact_email,staff_contact_phone,policy_briefs,committee_memberships,last_verified,role_tags
Pilar DEL CASTILLO VERA,Spain,EPP,pilar.delcastillovera@europarl.europa.eu,N/A,N/A,N/A,Industry; Research; Energy; Digital infrastructure; Data Act Rapporteur,ITRE,2024-12-15,rapporteur
Bart GROOTHUIS,Netherlands,Renew Europe,bart.groothuis@europarl.europa.eu,N/A,N/A,N/A,Cybersecurity; NIS2 Directive; digital infrastructure; AI; data protection,ITRE (Member); AFET (Substitute); INTA (Member),2024-12-15,
Seán KELLY,Ireland,EPP,sean.kelly@europarl.europa.eu,N/A,N/A,N/A,Industry; research; energy; digital infrastructure,ITRE (Member),2024-12-15,
Dan NICA,Romania,S&D,dan.nica@europarl.europa.eu,N/A,N/A,N/A,"Industry and research, digital technology, Horizon Europe, telecommunications, IT infrastructure, European Competitiveness Fund",ITRE (S&D Coordinator); ENVI,2024-12-15,coordinator
Jutta PAULUS,Germany,Greens/EFA,jutta.paulus@europarl.europa.eu,N/A,N/A,N/A,"Energy policy, climate, environmental technology, green industry, sustainable digital infrastructure",ITRE (substitute); ENVI,2024-12-15,
Tsvetelina PENKOVA,Bulgaria,S&D,tsvetelina.penkova@europarl.europa.eu,N/A,N/A,N/A,"Digital policy, AI Act, cybersecurity, energy, research, industry, telecommunications, data governance, consumer protection",ITRE (1st Vice-Chair); IMCO (substitute),2024-12-15,itre_vice_chair
Roberts ZĪLE,Latvia,ECR,roberts.zile@europarl.europa.eu,N/A,N/A,N/A,"Transport, economics, monetary affairs, Baltic relations, digital infrastructure",EP Vice-President; TRAN (Coordinator); ECON (Substitute),2024-12-15,coordinator; ep_vice_president
Kosma ZŁOTOWSKI,Poland,ECR,kosma.zlotowski@europarl.europa.eu,N/A,N/A,N/A,"Transport, infrastructure, technology, energy, digital connectivity",TRAN; ITRE,2024-12-15,
