mep_name,jurisdiction,political_group,email,staff_contact_name,staff_contact_email,staff_contact_phone,policy_briefs,committee_memberships,last_verified,role_tags
Brando BENIFEI,Italy,S&D,brando.benifei@europarl.europa.eu,N/A,N/A,N/A,AI Act Co-Rapporteur; Digital rights; Internal market; AI governance; Data protection,IMCO; LIBE,2024-12-15,ai_act_co_rapporteur; rapporteur
Pilar DEL CASTILLO VERA,Spain,EPP,pilar.delcastillovera@europarl.europa.eu,N/A,N/A,N/A,Industry; Research; Energy; Digital infrastructure; Data Act Rapporteur,ITRE,2024-12-15,rapporteur
Angelika NIEBLER,Germany,EPP,angelika.niebler@europarl.europa.eu,N/A,N/A,N/A,"Industry, research, energy, cybersecurity, data governance, AI/digital policy - Rapporteur on Data Governance Act and Cybersecurity Act",ITRE; JURI; IMCO; AFET; SEDE,2024-12-15,rapporteur
Christel SCHALDEMOSE,Denmark,S&D,christel.schaldemose@europarl.europa.eu,N/A,N/A,N/A,"Consumer protection, digital services, internal market, AI Act, Digital Services Act - Key rapporteur on digital legislation",IMCO,2024-12-15,dsa_rapporteur; rapporteur
Andreas SCHWAB,Germany,EPP,andreas.schwab@europarl.europa.eu,N/A,N/A,N/A,"Internal market, consumer protection, digital services, Digital Markets Act rapporteur, AI Act, competition policy",IMCO,2024-12-15,dma_rapporteur; rapporteur
