mep_name,jurisdiction,political_group,email,staff_contact_name,staff_contact_email,staff_contact_phone,policy_briefs,committee_memberships,last_verified,role_tags
Monika HOHLMEIER,Germany,EPP,monika.hohlmeier@europarl.europa.eu,N/A,N/A,N/A,Budgetary control; counter-terrorism; security; AI in law enforcement,CONT (Chair); LIBE (Substitute),2024-12-15,cont_chair
Dolors MONTSERRAT,Spain,EPP,dolors.montserrat@europarl.europa.eu,N/A,N/A,N/A,Petitions; civil liberties - PETI Chair,PETI (Chair); LIBE (Substitute),2024-12-15,peti_chair
Emil RADEV,Bulgaria,EPP,emil.radev@europarl.europa.eu,N/A,N/A,N/A,"Legal affairs, civil liberties, judicial cooperation, data protection, rule of law, e-CODEX digital judicial cooperation, AI Act implementation",JURI (Vice-Chair); LIBE; PETI,2024-12-15,juri_vice_chair
Tomas TOBÉ,Sweden,EPP,tomas.tobe@europarl.europa.eu,N/A,N/A,N/A,"Development aid, migration, asylum policy, civil liberties, digital policy",DEVE (Chair); LIBE (Member); ITRE (Substitute); EUDS,2024-12-15,deve_chair
Sophie WILMÈS,Belgium,Renew Europe,sophie.wilmes@europarl.europa.eu,N/A,N/A,N/A,"Human rights, democracy, rule of law, digital policy, transatlantic relations",EP Vice-President; LIBE (Member); ITRE (Substitute); EUDS,2024-12-15,ep_vice_president
